{
  "schema_version": "approval-action-command/v1alpha1",
  "command_id": "cmd_0198f4b2-7c3a-7d20-a5c6-6b6f39e34720",
  "card_id": "crd_0198f4b2-7c3a-7d12-a5c6-6b6f39e34712",
  "expected_revision": 1,
  "action": "approve",
  "selected_option_id": "opt_lib_a",
  "occurred_at": "2026-08-23T10:00:00.000Z",
  "actor": "CONSOLE_ACTOR",
  "idempotency_key": "approve-option-pick-1"
}
