{
  "schema_version": "approval-action-command/v1alpha1",
  "command_id": "cmd_0198f4b2-7c3a-7d21-a5c6-6b6f39e34721",
  "card_id": "crd_0198f4b2-7c3a-7d14-a5c6-6b6f39e34714",
  "expected_revision": 1,
  "action": "approve",
  "occurred_at": "2026-08-23T10:05:00.000Z",
  "actor": "CONSOLE_ACTOR",
  "idempotency_key": "approve-gate-go-1"
}
